"Title","Date","URL"
"Machinery in Kovon to continue Madang-Baiyer Road project",2025-07-28,"https://tvwan.com.pg/news/5410"
"Candidate angry over election mishaps",2025-07-28,"https://tvwan.com.pg/news/5406"
"12 arrested in Madang",2025-07-28,"https://tvwan.com.pg/news/5405"
"Pinu kicks off sport tournament",2025-07-28,"https://tvwan.com.pg/news/5404"
"Mekeo Culture Heads to Europe",2025-07-28,"https://tvwan.com.pg/news/5403"
"2025 RPNGC recruits set to train",2025-07-27,"https://tvwan.com.pg/news/5401"
"PNG observes Judiciary Well-being Day",2025-07-27,"https://tvwan.com.pg/news/5400"
"US vessel docks in Lae",2025-07-27,"https://tvwan.com.pg/news/5399"
"Koiari leaders wanted for illegal protest",2025-07-26,"https://tvwan.com.pg/news/5396"
"Western Flames Win Inaugural Koiari Zone Championship Cup",2025-07-26,"https://tvwan.com.pg/news/5394"
"PRL 15 landowners changing the game in LO participation in projects",2025-07-26,"https://tvwan.com.pg/news/5393"
"CS graduates challenged to serve nation with pride",2025-07-26,"https://tvwan.com.pg/news/5390"
"Parkop Congratulates New MKA Chairman Wavik",2025-07-26,"https://tvwan.com.pg/news/5389"
"Bugandi prepares for new classroom",2025-07-26,"https://tvwan.com.pg/news/5388"
"First-Ever Use of PNG Soil in Exercise Talisman Sabre",2025-07-26,"https://tvwan.com.pg/news/5387"
"Ballot box hijacked in Usino Bundi by-election",2025-07-26,"https://tvwan.com.pg/news/5386"
"Laws relating to Sexual Offences and SOE to be reviewed",2025-07-26,"https://tvwan.com.pg/news/5385"
"Latin America Meets Pacific",2025-07-25,"https://tvwan.com.pg/news/5380"
"Usino/ Bundi by-election update",2025-07-25,"https://tvwan.com.pg/news/5377"
"PM Welcomes ICJ Advisory Opinion",2025-07-25,"https://tvwan.com.pg/news/5374"
"PM Concludes Landmark Visit to Japan",2025-07-25,"https://tvwan.com.pg/news/5373"
"POMNATS, Kopkop College in debate grand final",2025-07-25,"https://tvwan.com.pg/news/5371"
"Manning condemns LO actions over water supply",2025-07-24,"https://tvwan.com.pg/news/5370"
"Last count, four votes difference",2025-07-24,"https://tvwan.com.pg/news/5369"
"International Court rules in favor of Pacific Island states",2025-07-24,"https://tvwan.com.pg/news/5368"
"Disgruntled crowd angered over ballot box security",2025-07-24,"https://tvwan.com.pg/news/5366"
"Japan Backs PNG Fisheries Growth",2025-07-24,"https://tvwan.com.pg/news/5362"
"Ramu NiCo chips in K50,000 for Madang Independence Celebrations",2025-07-24,"https://tvwan.com.pg/news/5359"
"Milne Bay Honors Heroes",2025-07-24,"https://tvwan.com.pg/news/5358"
"Day 2 of polling for Usino Bundi by-election",2025-07-24,"https://tvwan.com.pg/news/5354"
"Motu Koita election Officials aim to declare winners before Friday",2025-07-24,"https://tvwan.com.pg/news/5353"
"Marape Defends Appointment of New KPHL Board in the Face of Court Order",2025-07-23,"https://tvwan.com.pg/news/5351"
"Engineering Battalion Soldiers Reach Ramu Valley",2025-07-23,"https://tvwan.com.pg/news/5350"
"Frangipani Expands to Kavieng",2025-07-23,"https://tvwan.com.pg/news/5349"
"Police band recognized",2025-07-23,"https://tvwan.com.pg/news/5348"
"Kundiawa Police Mark 50 Years",2025-07-23,"https://tvwan.com.pg/news/5347"
"Pariwa commits to 80K for Lalok village",2025-07-23,"https://tvwan.com.pg/news/5346"
"PM pays tribute to fallen heroes",2025-07-23,"https://tvwan.com.pg/news/5345"
"Wavik leads MKA count",2025-07-23,"https://tvwan.com.pg/news/5344"
"Polling concludes in Kabwum",2025-07-23,"https://tvwan.com.pg/news/5343"
"Counting for Key MKA Seats Set",2025-07-23,"https://tvwan.com.pg/news/5341"
"A recollection of the unsung heroes by Madang PPC",2025-07-23,"https://tvwan.com.pg/news/5340"
"“At the Break of Dawn: Honoring PNG’s Heroes of Sacrifice and Service”",2025-07-23,"https://tvwan.com.pg/news/5339"
"Sonk labels reports as defamatory",2025-07-22,"https://tvwan.com.pg/news/5338"
"New KPHL board appointment stayed",2025-07-22,"https://tvwan.com.pg/news/5337"
"NCSL brings financial literacy to workplace",2025-07-22,"https://tvwan.com.pg/news/5335"
"Jets acknowledge Hunters",2025-07-22,"https://tvwan.com.pg/news/5334"
"ABG presents K1 million to MAF to re-establish presence in the region",2025-07-22,"https://tvwan.com.pg/news/5332"
"Tribes in Enga End Long-Standing Dispute",2025-07-22,"https://tvwan.com.pg/news/5330"
"Usino-Bundi by-election starts July 22",2025-07-21,"https://tvwan.com.pg/news/5326"
"Challenges faced by first years",2025-07-21,"https://tvwan.com.pg/news/5324"
"PNGETV 2027 ready for September launch",2025-07-21,"https://tvwan.com.pg/news/5323"
"Legacy issues affect Modilon hospital service delivery",2025-07-20,"https://tvwan.com.pg/news/5316"
"Cricketers visit PNG Resources Golden Exhibition",2025-07-20,"https://tvwan.com.pg/news/5315"
"Masiu is alive and well",2025-07-20,"https://tvwan.com.pg/news/5314"
"Revive Arts Education in PNG",2025-07-20,"https://tvwan.com.pg/news/5311"
"Parkop receives Tete’s clinical services plan",2025-07-20,"https://tvwan.com.pg/news/5310"
"Highlands Day Celebration marred by overcrowding and violence",2025-07-20,"https://tvwan.com.pg/news/5308"
"Walk of Solidarity heads to Morobe",2025-07-19,"https://tvwan.com.pg/news/5307"
"154 PNGDF recruits pass out",2025-07-19,"https://tvwan.com.pg/news/5305"
"PNG Soldiers Reenact 1975 Journey",2025-07-19,"https://tvwan.com.pg/news/5304"
"MV IBK commissioned to serve Kikori District",2025-07-19,"https://tvwan.com.pg/news/5303"
"Two Decades of Media Growth",2025-07-19,"https://tvwan.com.pg/news/5302"
"Life-Saving Lab Partnership Launched",2025-07-19,"https://tvwan.com.pg/news/5299"
"PM to Seek Full Evidence from Overseas Media on KPHL Reports",2025-07-19,"https://tvwan.com.pg/news/5296"
"TVI Building Local Leadership & Collective Action",2025-07-18,"https://tvwan.com.pg/news/5291"
"Boera villages attain sewing skills",2025-07-18,"https://tvwan.com.pg/news/5290"
"Balimo College launches new Nursing School",2025-07-18,"https://tvwan.com.pg/news/5289"
"More ENB resettlers to get land titles",2025-07-18,"https://tvwan.com.pg/news/5288"
"Sonk steps down as director of PNG NRL Board",2025-07-18,"https://tvwan.com.pg/news/5287"
"Central to upgrade airstrips",2025-07-18,"https://tvwan.com.pg/news/5285"
"Holy Moses deported",2025-07-18,"https://tvwan.com.pg/news/5283"
"Reserve unit make successful arrest",2025-07-17,"https://tvwan.com.pg/news/5281"
"Police deal with fake news Public praised for reporting fake news",2025-07-17,"https://tvwan.com.pg/news/5280"
"Nope police file ready",2025-07-17,"https://tvwan.com.pg/news/5279"
"IBSU, bank paves way for job placements",2025-07-17,"https://tvwan.com.pg/news/5275"
"PNGNA launches Savings & Loans service",2025-07-17,"https://tvwan.com.pg/news/5272"
"PNG Gears Up for 9th Pacific Tuna Forum",2025-07-17,"https://tvwan.com.pg/news/5268"
"Police tighten entry controls in Porgera Paiela",2025-07-16,"https://tvwan.com.pg/news/5250"
"FRL Backs Sepik River Crocodile Festival",2025-07-16,"https://tvwan.com.pg/news/5249"
"NCDPHA set up audit committee",2025-07-16,"https://tvwan.com.pg/news/5247"
"Intro: POM City Markets Gets K10,000",2025-07-16,"https://tvwan.com.pg/news/5246"
"NCDPHA retirees underwent financial literacy training",2025-07-16,"https://tvwan.com.pg/news/5245"
"9 arrested for transporting marijuana in Kikori",2025-07-16,"https://tvwan.com.pg/news/5244"
"PNG Music Mourns Barike Pioneer Matalau Nakikus",2025-07-16,"https://tvwan.com.pg/news/5239"
"Muruks and Lahanis players, officials charged",2025-07-15,"https://tvwan.com.pg/news/5238"
"Suspect in officer’s brutal killing in custody",2025-07-15,"https://tvwan.com.pg/news/5236"
"New autonomy committee in ENB",2025-07-15,"https://tvwan.com.pg/news/5233"
"HIV infection rates rapidly increasing",2025-07-15,"https://tvwan.com.pg/news/5231"
"PNG push for full membership in ASEAN",2025-07-15,"https://tvwan.com.pg/news/5228"
"Locals embrace Wariman job prospects",2025-07-15,"https://tvwan.com.pg/news/5227"
"Building Agriculture with transformation plans",2025-07-15,"https://tvwan.com.pg/news/5226"
"Team PNG return home",2025-07-15,"https://tvwan.com.pg/news/5224"
"Volunteer promotes conservation of ‘Oro Butterfly’",2025-07-14,"https://tvwan.com.pg/news/5220"
"Karkar schools get new classrooms",2025-07-14,"https://tvwan.com.pg/news/5217"
"Gov’t commits to achieving balanced national budget by 2027",2025-07-14,"https://tvwan.com.pg/news/5211"
"Port Moresby, California signs Sister City partnership",2025-07-13,"https://tvwan.com.pg/news/5205"
"NGI Day Celebrated – One Time, One Nation",2025-07-13,"https://tvwan.com.pg/news/5204"
"MKA Roads Program Advances",2025-07-13,"https://tvwan.com.pg/news/5202"
"Speeding Truck Causes Crash",2025-07-12,"https://tvwan.com.pg/news/5200"
"Vibrant Mask Festival Celebrated",2025-07-12,"https://tvwan.com.pg/news/5198"
"WNBPG Renews Health Commitment",2025-07-12,"https://tvwan.com.pg/news/5197"
"Menyamya’s five brave students",2025-07-12,"https://tvwan.com.pg/news/5195"
"Manning participates in Pacific Commissioner’ Fitness Challenge",2025-07-12,"https://tvwan.com.pg/news/5194"
"Landau to lead high-level US delegation to Golden Jubilee Celebrations",2025-07-12,"https://tvwan.com.pg/news/5193"
"Promoting inclusive workplaces in PNG",2025-07-12,"https://tvwan.com.pg/news/5192"
"Barras Trials Heat Up",2025-07-11,"https://tvwan.com.pg/news/5189"
"Jiwaka police report two deaths after SOO 3",2025-07-11,"https://tvwan.com.pg/news/5187"
"PNGDF launch 50th walk",2025-07-11,"https://tvwan.com.pg/news/5186"
"NAC announces airport capacity for A220s",2025-07-11,"https://tvwan.com.pg/news/5185"
"Minister upset over students' inappropriate behaviour",2025-07-11,"https://tvwan.com.pg/news/5184"
"Manning calls for immediate intervention in Hela",2025-07-11,"https://tvwan.com.pg/news/5182"
"312 recruits for 2025 police training",2025-07-11,"https://tvwan.com.pg/news/5181"
"17 arrested over sorcery-related murders",2025-07-11,"https://tvwan.com.pg/news/5180"
"EU, PNG reinforce partnership with new investments",2025-07-10,"https://tvwan.com.pg/news/5178"
"Colourful student parade opens exhibition",2025-07-10,"https://tvwan.com.pg/news/5175"
"Kimbe Port Redevelopment Underway",2025-07-10,"https://tvwan.com.pg/news/5173"
"Kumul Joins Global Spotlight",2025-07-10,"https://tvwan.com.pg/news/5171"
"Digital Boost for Simbu School of Nursing",2025-07-10,"https://tvwan.com.pg/news/5170"
"Simbu crackdown on cheap, harmful liquor",2025-07-10,"https://tvwan.com.pg/news/5168"
"Lae team tours Australian vessel",2025-07-10,"https://tvwan.com.pg/news/5167"
"Milestone 100th game for skipper, Ila Alu",2025-07-09,"https://tvwan.com.pg/news/5161"
"Gulf align with NCC to promote culture",2025-07-09,"https://tvwan.com.pg/news/5160"
"Call for tougher penalties against PMV operators",2025-07-09,"https://tvwan.com.pg/news/5159"
"Support for border health preparedness",2025-07-09,"https://tvwan.com.pg/news/5158"
"Hanuabada situation under control",2025-07-09,"https://tvwan.com.pg/news/5157"
"State uniforms banned at school event",2025-07-09,"https://tvwan.com.pg/news/5155"
"TFPNG hosts referee clinic in Northern",2025-07-09,"https://tvwan.com.pg/news/5154"
"K24mil Madang road program launched",2025-07-09,"https://tvwan.com.pg/news/5153"
"PNGDF and police uniforms among civilians",2025-07-09,"https://tvwan.com.pg/news/5151"
"Review into police brutality laws",2025-07-09,"https://tvwan.com.pg/news/5149"
"ICAC Acting Members sworn in",2025-07-08,"https://tvwan.com.pg/news/5146"
"PM Marape meets King Charles III",2025-07-08,"https://tvwan.com.pg/news/5144"
"Major roadwork contracts for WNB, Madang",2025-07-08,"https://tvwan.com.pg/news/5141"
"Makiba condemns brutal killing in Magarima",2025-07-08,"https://tvwan.com.pg/news/5140"
"Strengthen early warning systems",2025-07-08,"https://tvwan.com.pg/news/5137"
"Legislative training to upskill CLRC staff",2025-07-08,"https://tvwan.com.pg/news/5136"
"PNG Athletics quartet set record",2025-07-08,"https://tvwan.com.pg/news/5133"
"Eight surrender over sorcery-related killing",2025-07-07,"https://tvwan.com.pg/news/5121"
"Digicel ExxonMobil Cup Resumes",2025-07-07,"https://tvwan.com.pg/news/5118"
"Court dismisses allegations against City Manager",2025-07-07,"https://tvwan.com.pg/news/5117"
"PM condemns torture of woman accused of sorcery",2025-07-07,"https://tvwan.com.pg/news/5115"
"40 combatants arrested during a joint raid in Hela",2025-07-07,"https://tvwan.com.pg/news/5112"
"ENB acknowledges LLG election deferral",2025-07-07,"https://tvwan.com.pg/news/5111"
"Waiembi debuts in Hunters’ shake-up",2025-07-06,"https://tvwan.com.pg/news/5107"
"EHP community sign conservation deed",2025-07-05,"https://tvwan.com.pg/news/5105"
"PNG citizens in Israel return home safely",2025-07-05,"https://tvwan.com.pg/news/5103"
"MoU signed to strengthen public service delivery at Nadzab",2025-07-04,"https://tvwan.com.pg/news/5099"
"Terminated police officer arraigned",2025-07-04,"https://tvwan.com.pg/news/5098"
"Digicel PNG Foundation Awards K100,000 Grant to iCare4U Center",2025-07-04,"https://tvwan.com.pg/news/5096"
"PM Marape highlights shared values on US Independence Day",2025-07-04,"https://tvwan.com.pg/news/5094"
"TIPNG Emphasizes Need to Preserve ICAC’s Integrity",2025-07-04,"https://tvwan.com.pg/news/5093"
"Payroll monitoring officer arrested for misappropriation",2025-07-03,"https://tvwan.com.pg/news/5087"
"57-year-old woman committed for selling late husband's property",2025-07-03,"https://tvwan.com.pg/news/5086"
"PNG seeks to harvest oil and gas reserves before clean energy era arrives",2025-07-03,"https://tvwan.com.pg/news/5082"
"Goi takes a hard line on airport security breaches",2025-07-03,"https://tvwan.com.pg/news/5080"
"Traffic incidents in Central Province increasing",2025-07-03,"https://tvwan.com.pg/news/5079"
"CLRC reviews laws on underwater leases and waterways",2025-07-03,"https://tvwan.com.pg/news/5078"
"Female re-arrested, 12 in hiding",2025-07-03,"https://tvwan.com.pg/news/5077"
"Teachers failing to take up roles in remote schools",2025-07-03,"https://tvwan.com.pg/news/5076"
"Foreign national arrested for drug trafficking offences",2025-07-03,"https://tvwan.com.pg/news/5075"
"Peacebuilder Carries PNG Hopes to Peace Summit",2025-07-02,"https://tvwan.com.pg/news/5074"
"Unreliable power supply poses a threat to development of Lae SEZ",2025-07-02,"https://tvwan.com.pg/news/5073"
"ENB prepares for LLG polling",2025-07-02,"https://tvwan.com.pg/news/5072"
"Suspended police officers and civilians arraigned over drug possession",2025-07-02,"https://tvwan.com.pg/news/5070"
"MoU signed to strengthen disease prevention efforts",2025-07-01,"https://tvwan.com.pg/news/5059"
"Water and Education Improvements Across Morobe Schools through partnership",2025-07-01,"https://tvwan.com.pg/news/5058"
"Sea Shepherd assists Bougainville combat illegal fishing",2025-07-01,"https://tvwan.com.pg/news/5057"
"Parliamentary Committee begins inquiry into state authorities",2025-07-01,"https://tvwan.com.pg/news/5055"
"K20,000 for Yal cocoa farmers",2025-07-01,"https://tvwan.com.pg/news/5054"
"PNGUoT graduates to be globally competitive",2025-07-01,"https://tvwan.com.pg/news/5053"
"Maru to make submissions for Vanimo Free Trade Zone",2025-07-01,"https://tvwan.com.pg/news/5048"
"Sumkar DDA seeks education pathway",2025-07-01,"https://tvwan.com.pg/news/5047"
"Doctor Behind Fake COVID-19 Research Firm Arrested",2025-07-01,"https://tvwan.com.pg/news/5046"
"Owning and buying a home - Hausples Expo",2025-06-29,"https://tvwan.com.pg/news/5027"
"IOM and PNG Affirm Commitment to Migration and Development",2025-06-29,"https://tvwan.com.pg/news/5026"
"PNG to benefit from USD $42 million GEF funded program",2025-06-28,"https://tvwan.com.pg/news/5025"
"Addressing dependence on meat imports",2025-06-28,"https://tvwan.com.pg/news/5024"
"Teaching Service Council returns – members sworn in",2025-06-28,"https://tvwan.com.pg/news/5023"
"Plans to overhaul trade regulatory systems",2025-06-28,"https://tvwan.com.pg/news/5022"
"Exercise Puk Puk comes to a close",2025-06-28,"https://tvwan.com.pg/news/5019"
"New accommodation for female soldiers officially opened",2025-06-27,"https://tvwan.com.pg/news/5017"
"Senior IT officer charged with misappropriation",2025-06-27,"https://tvwan.com.pg/news/5016"
"HIV Declared a National Crisis",2025-06-27,"https://tvwan.com.pg/news/5015"
"Beon inmate wins Jacks design competition",2025-06-27,"https://tvwan.com.pg/news/5014"
"Melanesian Agreement Signed",2025-06-27,"https://tvwan.com.pg/news/5013"
"PNG Ports supports SEZ summit as Gold Sponsor",2025-06-27,"https://tvwan.com.pg/news/5012"
"Agreement signed for Nadzab cargo hub",2025-06-26,"https://tvwan.com.pg/news/5008"
"No referral fees at NCD clinics",2025-06-26,"https://tvwan.com.pg/news/5007"
"SSD receives land authorization certificate",2025-06-26,"https://tvwan.com.pg/news/5006"
"Partnering for economic prosperity",2025-06-26,"https://tvwan.com.pg/news/5005"
"Reaffirmed Commitment to Justice and Migration Governance",2025-06-26,"https://tvwan.com.pg/news/5004"
"Cocoa farming boosted in Madang",2025-06-26,"https://tvwan.com.pg/news/5002"
"St John Day celebrated with Awards for Service and Dedication",2025-06-26,"https://tvwan.com.pg/news/5001"
"United action required to stop unregulated alluvial mining",2025-06-26,"https://tvwan.com.pg/news/5000"
"Gerehu Hospital receives assistance",2025-06-26,"https://tvwan.com.pg/news/4999"
"Oil Palm Festival launched",2025-06-25,"https://tvwan.com.pg/news/4997"
"SARV Victims’ Families Receive Support",2025-06-25,"https://tvwan.com.pg/news/4995"
"INA and CIMC staff explore BSP’s insurance product",2025-06-25,"https://tvwan.com.pg/news/4994"
"Government urged to implement the EITI Standard to Avoid Grey-Listing",2025-06-25,"https://tvwan.com.pg/news/4993"
"Oil Palm Festival Starts",2025-06-25,"https://tvwan.com.pg/news/4991"
"Maritime industry embrace value-based teaching",2025-06-25,"https://tvwan.com.pg/news/4988"
"Kundiawa police on the lookout for escapees",2025-06-24,"https://tvwan.com.pg/news/4981"
"MSG reviews reform and membership",2025-06-24,"https://tvwan.com.pg/news/4978"
"Yangoru-Saussia launches 9km road project",2025-06-23,"https://tvwan.com.pg/news/4965"
"Proper land titles key for Sepik Plain SEZ project",2025-06-23,"https://tvwan.com.pg/news/4963"
"Kapore to host Oil Palm Festival",2025-06-23,"https://tvwan.com.pg/news/4961"
"Lewas wins PacificAus Sports cricket challenge",2025-06-23,"https://tvwan.com.pg/news/4959"
"PNGFA seals MOU to progress downstream processing",2025-06-23,"https://tvwan.com.pg/news/4956"
"Police vehicles damaged",2025-06-22,"https://tvwan.com.pg/news/4950"
"New electric trucks introduced to PNG",2025-06-22,"https://tvwan.com.pg/news/4949"
"A new start for police reservists",2025-06-22,"https://tvwan.com.pg/news/4948"
"Australia-PNG Partnership Boosts Women’s Research Capacity",2025-06-22,"https://tvwan.com.pg/news/4945"
"PNG childhood educators acquire skills under PALM scheme",2025-06-21,"https://tvwan.com.pg/news/4944"
"Marape describes new Alotau–POM route as “Tourism Highway”",2025-06-21,"https://tvwan.com.pg/news/4943"
"NCDPHA website launched",2025-06-21,"https://tvwan.com.pg/news/4942"
"Milne Bay successfully linked to Port Moresby via road",2025-06-21,"https://tvwan.com.pg/news/4939"
"New Cocoa Nurseries for Pomio LLG",2025-06-21,"https://tvwan.com.pg/news/4938"
"RISE builds female leaders in PNG",2025-06-20,"https://tvwan.com.pg/news/4931"
"Police to monitor highway following death",2025-06-20,"https://tvwan.com.pg/news/4930"
"Growing concerns of drug smuggling into NCD",2025-06-20,"https://tvwan.com.pg/news/4927"
"PPCC pleased with Momase Communications inquiry",2025-06-20,"https://tvwan.com.pg/news/4925"
"Deshbesh Proposes Livestock Sector Reform",2025-06-19,"https://tvwan.com.pg/news/4923"
"Policeman in Waigani shooting arraigned",2025-06-19,"https://tvwan.com.pg/news/4920"
"Simbu LLG Election Preparation Faces Hurdles",2025-06-19,"https://tvwan.com.pg/news/4917"
"Drugs slip past airport security",2025-06-19,"https://tvwan.com.pg/news/4916"
"First-ever Resource Recovery Centre launched",2025-06-18,"https://tvwan.com.pg/news/4913"
"NCD/Central Command takes steps to address police impersonation",2025-06-18,"https://tvwan.com.pg/news/4907"
"Farmer acknowledges effort",2025-06-17,"https://tvwan.com.pg/news/4904"
"Prisoners bash alleged rapist",2025-06-17,"https://tvwan.com.pg/news/4903"
"Australia proud to support future leaders",2025-06-17,"https://tvwan.com.pg/news/4900"
"Guinness clocks in 50 years of service",2025-06-17,"https://tvwan.com.pg/news/4895"
"Kas calls for resettlement of Manam islanders",2025-06-17,"https://tvwan.com.pg/news/4894"
"SEZs to improve country’s standing",2025-06-17,"https://tvwan.com.pg/news/4891"
"Lands Secretary charged",2025-06-16,"https://tvwan.com.pg/news/4890"
"Squash youngster claims second award",2025-06-16,"https://tvwan.com.pg/news/4885"
"PNGDF Chief visits Moem Barracks",2025-06-16,"https://tvwan.com.pg/news/4884"
"Cops caught in drug bust",2025-06-16,"https://tvwan.com.pg/news/4881"
"PNGFA welcomes Forest Finance Programme",2025-06-16,"https://tvwan.com.pg/news/4880"
"Best Performing PHAs awarded",2025-06-15,"https://tvwan.com.pg/news/4878"
"Dame Meg Taylor lead Walk Against Corruption",2025-06-15,"https://tvwan.com.pg/news/4877"
"PNGDF recruit of 94 marks three decades",2025-06-15,"https://tvwan.com.pg/news/4876"
"Empowering young women 30 years on",2025-06-15,"https://tvwan.com.pg/news/4875"
"Malaysia Day Celebrates Cultural Friendship",2025-06-15,"https://tvwan.com.pg/news/4874"
"Hidden Valley Revised CDA initialed",2025-06-14,"https://tvwan.com.pg/news/4870"
"PNG-Bougainville Consultations Endorse Melanesian Relationship Agreement",2025-06-14,"https://tvwan.com.pg/news/4869"
"DPM Rosso impressed with Kumul23 Training",2025-06-14,"https://tvwan.com.pg/news/4867"
"Government provides K4m freight subsidy for cocoa farmers",2025-06-14,"https://tvwan.com.pg/news/4866"
"No Bail for School Fight offenders",2025-06-14,"https://tvwan.com.pg/news/4864"
"Probationary Constables join Madang police",2025-06-14,"https://tvwan.com.pg/news/4863"
"Morobe polling officials petition EC",2025-06-14,"https://tvwan.com.pg/news/4862"
"Polio vaccines arrive",2025-06-14,"https://tvwan.com.pg/news/4861"
"Nature Park Celebrates 13 Years",2025-06-14,"https://tvwan.com.pg/news/4860"
"Monitoring compliance a challenge",2025-06-13,"https://tvwan.com.pg/news/4856"
"MV Scorpio Marks a New Era for Sumkar",2025-06-13,"https://tvwan.com.pg/news/4855"
"Pilot Jailed for Drug Smuggling",2025-06-13,"https://tvwan.com.pg/news/4854"
"Marape Honors PANGU Legacy",2025-06-13,"https://tvwan.com.pg/news/4853"
"Officer charged with willful murder",2025-06-13,"https://tvwan.com.pg/news/4852"
"RTA launches three-year roadmap",2025-06-13,"https://tvwan.com.pg/news/4851"
"Islanders soon to call Andarum home",2025-06-13,"https://tvwan.com.pg/news/4850"
"More Funding Support for the 2nd PNG SEZ Summit",2025-06-13,"https://tvwan.com.pg/news/4848"
"Call to strengthen security in schools",2025-06-13,"https://tvwan.com.pg/news/4847"
"Bilateral defence treaty negotiations commence",2025-06-13,"https://tvwan.com.pg/news/4846"
"Mobile police barracks to be constructed",2025-06-13,"https://tvwan.com.pg/news/4845"
"PNG-based dual Australian and Nigerian citizen charged with human trafficking of PNG nationals",2025-06-12,"https://tvwan.com.pg/news/4841"
"Trainee graduates urged to champion Financial Literacy",2025-06-12,"https://tvwan.com.pg/news/4838"
"Imi Ward Development Plan Launch",2025-06-12,"https://tvwan.com.pg/news/4837"
"Hope emerges for displaced Manam Islanders",2025-06-12,"https://tvwan.com.pg/news/4835"
"Simbu projects assessed in Nationwide Evaluation Exercise",2025-06-12,"https://tvwan.com.pg/news/4834"
"Recruits deployment commences this Friday",2025-06-12,"https://tvwan.com.pg/news/4833"
"SEZ license approved for Sea Park Development at Ela Beach",2025-06-12,"https://tvwan.com.pg/news/4832"
"Police Work Boosted in Kairuku District",2025-06-12,"https://tvwan.com.pg/news/4831"
"History comes home on the wings of a Hell’N Pelican",2025-06-12,"https://tvwan.com.pg/news/4830"
"Agencies Collaborate to Ensure Compliance with New Tax Measures",2025-06-12,"https://tvwan.com.pg/news/4829"
"NDoH launches digital strategies",2025-06-11,"https://tvwan.com.pg/news/4828"
"Military boot camp continues for PNGUoT",2025-06-11,"https://tvwan.com.pg/news/4827"
"Court Denies Rapists’ Plea to Stay at Boroko Cell",2025-06-11,"https://tvwan.com.pg/news/4824"
"PNG commits to Sustainable Ocean Governance with Historic Treaty Signing",2025-06-11,"https://tvwan.com.pg/news/4823"
"PNG and Australia Lead Regional Effort to Improve Anaesthetic Care",2025-06-11,"https://tvwan.com.pg/news/4819"
"Historical Aircraft Returns to PNG",2025-06-11,"https://tvwan.com.pg/news/4817"
"Media seminar for youths",2025-06-11,"https://tvwan.com.pg/news/4816"
"Madang Traffic Office gets facelift",2025-06-10,"https://tvwan.com.pg/news/4814"
"MAF’s New aircraft in service",2025-06-10,"https://tvwan.com.pg/news/4813"
"Alleged rapists arraigned today",2025-06-10,"https://tvwan.com.pg/news/4812"
"No deep-sea mining in PNG",2025-06-10,"https://tvwan.com.pg/news/4809"
"MSG Cup Returns to PNG",2025-06-09,"https://tvwan.com.pg/news/4804"
"PANGU Pati to celebrate 58th anniversary",2025-06-09,"https://tvwan.com.pg/news/4803"
"One arrested, 35 yet to be arrested",2025-06-09,"https://tvwan.com.pg/news/4802"
"Saraga rape suspect still on the run",2025-06-09,"https://tvwan.com.pg/news/4800"
"What is your contribution?",2025-06-09,"https://tvwan.com.pg/news/4799"
