"Title","Date","URL"
"LDC aims to clear Lae land",2025-04-29,"https://tvwan.com.pg/news/4187"
"Law school graduates 188 students",2025-04-29,"https://tvwan.com.pg/news/4181"
"Prime Minister summons health officials",2025-04-29,"https://tvwan.com.pg/news/4178"
"Election of new Pope to begin on May 7th",2025-04-29,"https://tvwan.com.pg/news/4175"
"Tragic Landslide in EHP Claims Lives",2025-04-28,"https://tvwan.com.pg/news/4173"
"Inland Baining LLG President to defend his seat",2025-04-28,"https://tvwan.com.pg/news/4172"
"K50 bank note and coin launched",2025-04-28,"https://tvwan.com.pg/news/4170"
"Vipers Academy Player settles well in UK",2025-04-27,"https://tvwan.com.pg/news/4164"
"Dormant film industry",2025-04-27,"https://tvwan.com.pg/news/4163"
"Independence as seen through Aiga’s lens",2025-04-26,"https://tvwan.com.pg/news/4157"
"Kairuku Remembers Holy Father",2025-04-26,"https://tvwan.com.pg/news/4156"
"Expatriate arrested and charged under the ‘Lukautim Pikinini Act’",2025-04-26,"https://tvwan.com.pg/news/4153"
"Reconstructive surgeries restore hope in East Sepik",2025-04-26,"https://tvwan.com.pg/news/4152"
"NCDPHA commemorates World Malaria Day",2025-04-26,"https://tvwan.com.pg/news/4151"
"Baiyer landowners encouraged to prepare for future gains",2025-04-26,"https://tvwan.com.pg/news/4150"
"Kairuku Remembers Holy Father",2025-04-26,"https://tvwan.com.pg/news/4149"
"91 lawyers admitted to the bar",2025-04-26,"https://tvwan.com.pg/news/4147"
"Brussels ambassador to represent PNG at Pope’s Funeral",2025-04-26,"https://tvwan.com.pg/news/4145"
"ENB conducts final sitting of provincial assembly",2025-04-25,"https://tvwan.com.pg/news/4144"
"Fees paid for Sumkar students",2025-04-25,"https://tvwan.com.pg/news/4143"
"Wardens deployed to Manu",2025-04-24,"https://tvwan.com.pg/news/4136"
"Japan Shares Governance Lessons in PNG",2025-04-24,"https://tvwan.com.pg/news/4135"
"Rigo Schools Rugby League set for Gala Day",2025-04-24,"https://tvwan.com.pg/news/4130"
"Kokoda porter shares history",2025-04-24,"https://tvwan.com.pg/news/4129"
"33 prosecutors graduate",2025-04-24,"https://tvwan.com.pg/news/4128"
"By-election writs issued",2025-04-24,"https://tvwan.com.pg/news/4125"
"Pilot dies in aircraft crash",2025-04-24,"https://tvwan.com.pg/news/4124"
"Women’s softball team finalises squad this week",2025-04-24,"https://tvwan.com.pg/news/4123"
"Dr Billy calls for stability",2025-04-24,"https://tvwan.com.pg/news/4122"
"FIJI 7’s team officials voice discontent",2025-04-24,"https://tvwan.com.pg/news/4121"
"A Call to Action for Kutubu",2025-04-24,"https://tvwan.com.pg/news/4120"
"Local rice farmers set to graduate",2025-04-24,"https://tvwan.com.pg/news/4118"
"LLG election dates confirmed",2025-04-24,"https://tvwan.com.pg/news/4117"
"Easter babies delivered at PMGH",2025-04-24,"https://tvwan.com.pg/news/4116"
"PNG to host part of multinational military exercise",2025-04-23,"https://tvwan.com.pg/news/4113"
"Book of Condolences Open",2025-04-23,"https://tvwan.com.pg/news/4111"
"PNG shows out at Osaka World Expo 2025",2025-04-23,"https://tvwan.com.pg/news/4106"
"ENB to upgrade and set up police posts",2025-04-23,"https://tvwan.com.pg/news/4105"
"Tkatchenko expresses great sadness",2025-04-23,"https://tvwan.com.pg/news/4104"
"Prime Minister Signals Tough Times Ahead for Citizens",2025-04-23,"https://tvwan.com.pg/news/4099"
"Call for review of parole process",2025-04-22,"https://tvwan.com.pg/news/4094"
"PMGH CEO responds",2025-04-22,"https://tvwan.com.pg/news/4093"
"Wau roadworks progress",2025-04-22,"https://tvwan.com.pg/news/4091"
"PM put emphasis on prison industry",2025-04-22,"https://tvwan.com.pg/news/4089"
"Prioritising education in new district",2025-04-22,"https://tvwan.com.pg/news/4088"
"Madang observes peaceful Easter, despite minor incidents",2025-04-22,"https://tvwan.com.pg/news/4086"
"‘Go out and be productive’",2025-04-22,"https://tvwan.com.pg/news/4085"
"Condolence Message from Prime Minister James Marape on the Passing of His Holiness Pope Francis",2025-04-21,"https://tvwan.com.pg/news/4081"
"PM Marape visits Bomana prison",2025-04-21,"https://tvwan.com.pg/news/4078"
"Dusin mission station receives Easter gift",2025-04-21,"https://tvwan.com.pg/news/4074"
"Pimaga to host Nipa Kutubu meeting",2025-04-21,"https://tvwan.com.pg/news/4073"
"Madang partners with OPIC",2025-04-21,"https://tvwan.com.pg/news/4072"
"16 injured in car incident",2025-04-21,"https://tvwan.com.pg/news/4070"
"Together in Hope and Renewal",2025-04-20,"https://tvwan.com.pg/news/4068"
"Six-mile polyclinic receives generator",2025-04-20,"https://tvwan.com.pg/news/4067"
"Students urged to maintain ICT integrity",2025-04-20,"https://tvwan.com.pg/news/4066"
"PNG named priority nation for IRL",2025-04-19,"https://tvwan.com.pg/news/4056"
"Fashion Week Launches with Style, Colour and Culture",2025-04-18,"https://tvwan.com.pg/news/4052"
"Public servants must resign to contest",2025-04-18,"https://tvwan.com.pg/news/4051"
"TVET workshop gets positive feedback",2025-04-18,"https://tvwan.com.pg/news/4050"
"No suitable data management system for PNG: Sinai",2025-04-18,"https://tvwan.com.pg/news/4047"
"‘Keep on keeping on’",2025-04-18,"https://tvwan.com.pg/news/4045"
"Cheshire disAbility residents grateful",2025-04-18,"https://tvwan.com.pg/news/4044"
"ENB launches LLG election program",2025-04-18,"https://tvwan.com.pg/news/4042"
"Madang welcomes SME credit scheme",2025-04-17,"https://tvwan.com.pg/news/4040"
"PNG not ready for elections",2025-04-17,"https://tvwan.com.pg/news/4037"
"Boosting Safety Along Critical Corridors",2025-04-17,"https://tvwan.com.pg/news/4036"
"Sumkar lass lauds school fee subsidy program",2025-04-17,"https://tvwan.com.pg/news/4033"
"NCDPHA hosts GESI training",2025-04-17,"https://tvwan.com.pg/news/4029"
"Old coffee plantations to undergo rehabilitation",2025-04-17,"https://tvwan.com.pg/news/4027"
"Building Bridges, Empowering Communities",2025-04-17,"https://tvwan.com.pg/news/4026"
"Sumkar cocoa development project makes progress",2025-04-17,"https://tvwan.com.pg/news/4025"
"Boram airport opened",2025-04-17,"https://tvwan.com.pg/news/4022"
"Joy, a rising star on the tracks",2025-04-17,"https://tvwan.com.pg/news/4021"
"Glamour Woven With Cultural Elegance",2025-04-17,"https://tvwan.com.pg/news/4020"
"World Bank warns PNG to lift standard of living",2025-04-16,"https://tvwan.com.pg/news/4019"
"CEFI and Western Pacific University sign MOU",2025-04-16,"https://tvwan.com.pg/news/4018"
"CCEP PNG Launches Great People Managers Program",2025-04-16,"https://tvwan.com.pg/news/4015"
"Datec celebrates 14th graduation ceremony",2025-04-16,"https://tvwan.com.pg/news/4014"
"MKA Wins Court Case",2025-04-16,"https://tvwan.com.pg/news/4011"
"Milne Bay Community Rallies for Disaster Relief",2025-04-16,"https://tvwan.com.pg/news/4008"
"Man arrested for impersonating Madang administrator",2025-04-16,"https://tvwan.com.pg/news/4006"
"Children deserve to thrive",2025-04-16,"https://tvwan.com.pg/news/3998"
"Man charged for fraudulently obtaining multiple passports",2025-04-16,"https://tvwan.com.pg/news/3997"
"EC makes change in councilors election",2025-04-16,"https://tvwan.com.pg/news/3995"
"184 police hire cars returned",2025-04-15,"https://tvwan.com.pg/news/3994"
"MKA receive K500,000 to conduct election",2025-04-15,"https://tvwan.com.pg/news/3993"
"NIP caretaker gov’t first provincial assembly meet",2025-04-15,"https://tvwan.com.pg/news/3992"
"Wau roads set for upgrade",2025-04-15,"https://tvwan.com.pg/news/3988"
"Tamiok Strike Deepens Military Ties",2025-04-15,"https://tvwan.com.pg/news/3986"
"PNGDF Graduates from SATMO Training",2025-04-15,"https://tvwan.com.pg/news/3985"
"Sinai announces election dates",2025-04-14,"https://tvwan.com.pg/news/3978"
"Rabaul rugby league host Peace Cup",2025-04-14,"https://tvwan.com.pg/news/3976"
"Feeder Road Delay Affects Rural Communities",2025-04-14,"https://tvwan.com.pg/news/3972"
"A journey of resilience",2025-04-14,"https://tvwan.com.pg/news/3970"
"Gerehu Hospital keen to improve patient care",2025-04-14,"https://tvwan.com.pg/news/3969"
"Boram airport temporarily closed",2025-04-13,"https://tvwan.com.pg/news/3968"
"Former Madang principal arrested for misappropriation",2025-04-13,"https://tvwan.com.pg/news/3967"
"2025 Police Recruitment Attracts 18,460 Applications",2025-04-13,"https://tvwan.com.pg/news/3966"
"Limit people’s movement into barracks says Manning",2025-04-13,"https://tvwan.com.pg/news/3965"
"St John responds to vehicle collision",2025-04-13,"https://tvwan.com.pg/news/3964"
"Provinces breaking Organic law s.119",2025-04-13,"https://tvwan.com.pg/news/3963"
"Ronnie Lavai’s dreams of being an engineer",2025-04-12,"https://tvwan.com.pg/news/3959"
"Pariwa challenges Marape to honor commitments",2025-04-12,"https://tvwan.com.pg/news/3955"
"PNG 50 years ago with Colleen",2025-04-11,"https://tvwan.com.pg/news/3953"
"Support Western Pacific University",2025-04-11,"https://tvwan.com.pg/news/3950"
"Make education your career: O’Neill",2025-04-11,"https://tvwan.com.pg/news/3949"
"Unitech hosts graduation today",2025-04-11,"https://tvwan.com.pg/news/3945"
"Western Pacific University Graduation",2025-04-11,"https://tvwan.com.pg/news/3944"
"Former PNG Pepes rep arraigned",2025-04-10,"https://tvwan.com.pg/news/3943"
"O’Neill calls on Marape to step down",2025-04-10,"https://tvwan.com.pg/news/3942"
"LLG Elections Nearing",2025-04-10,"https://tvwan.com.pg/news/3941"
"Enga MPs back PM",2025-04-10,"https://tvwan.com.pg/news/3937"
"Eoe targets Wutung Border Post to Open In September",2025-04-10,"https://tvwan.com.pg/news/3935"
"Marie Stopes, Femili PNG strengthen Ties",2025-04-09,"https://tvwan.com.pg/news/3932"
"Eagles Show Faith ahead of Season",2025-04-09,"https://tvwan.com.pg/news/3929"
"OTML Applauds Kiunga Terminal Milestone",2025-04-09,"https://tvwan.com.pg/news/3928"
"Toroama disgusted",2025-04-09,"https://tvwan.com.pg/news/3919"
"PM Marape commends Speaker for adhering to Court’s ruling",2025-04-08,"https://tvwan.com.pg/news/3916"
"Criminal charges against Act NOW manager dismissed",2025-04-08,"https://tvwan.com.pg/news/3915"
"VoNC process underway",2025-04-08,"https://tvwan.com.pg/news/3913"
"Mendi Munhiu DDA Submits Acquittals",2025-04-08,"https://tvwan.com.pg/news/3912"
"Magisterial services lack capacity",2025-04-08,"https://tvwan.com.pg/news/3910"
"Major Iga's Global Courage Recognized",2025-04-08,"https://tvwan.com.pg/news/3908"
"Boito welcomes leaders to agricultural meet",2025-04-08,"https://tvwan.com.pg/news/3904"
"Parliament adjourned to April 15",2025-04-08,"https://tvwan.com.pg/news/3902"
"Police officer receives tough penalty",2025-04-07,"https://tvwan.com.pg/news/3901"
"Police reduce hired vehicle expense",2025-04-07,"https://tvwan.com.pg/news/3900"
"Country needs good people: MP",2025-04-07,"https://tvwan.com.pg/news/3898"
"PNG’s judiciary receives over 5,000 legal textbooks",2025-04-07,"https://tvwan.com.pg/news/3897"
"Biaru road blocked due to misunderstanding",2025-04-07,"https://tvwan.com.pg/news/3896"
"Kaumu remains managing director for NAC",2025-04-07,"https://tvwan.com.pg/news/3893"
"MPs urged to make the right decisions",2025-04-07,"https://tvwan.com.pg/news/3891"
"NEC approves Korea model for rural development",2025-04-07,"https://tvwan.com.pg/news/3890"
"Lae Academy aims high",2025-04-07,"https://tvwan.com.pg/news/3889"
"Pundari backs Marape",2025-04-06,"https://tvwan.com.pg/news/3885"
"Constitutional institutions must step up",2025-04-06,"https://tvwan.com.pg/news/3884"
"Heart screening program commences",2025-04-06,"https://tvwan.com.pg/news/3882"
"Yangoru-Saussia, first district to establish National Court Services",2025-04-06,"https://tvwan.com.pg/news/3881"
"Bad Weather Disrupts Competitions",2025-04-06,"https://tvwan.com.pg/news/3880"
"NARI Staff Achieves High Distinction in a Japanese University",2025-04-06,"https://tvwan.com.pg/news/3879"
"IEA College hosts 31st Graduation",2025-04-05,"https://tvwan.com.pg/news/3875"
"Marape Gives Members Room to Reflect Before VONC",2025-04-05,"https://tvwan.com.pg/news/3873"
"PM responds to US tariff",2025-04-05,"https://tvwan.com.pg/news/3872"
"Sohe District acquits DSIP funds",2025-04-05,"https://tvwan.com.pg/news/3871"
"PNGDF ATW makes progress on international stage",2025-04-04,"https://tvwan.com.pg/news/3861"
"No money for LLG elections",2025-04-03,"https://tvwan.com.pg/news/3859"
"Unveiling of Bong’s aircraft",2025-04-03,"https://tvwan.com.pg/news/3858"
"Hiri Koiari presents 2023 – 2024 Acquittals",2025-04-03,"https://tvwan.com.pg/news/3857"
"Continuous flooding a threat to livestock",2025-04-03,"https://tvwan.com.pg/news/3854"
"Court dismissed allegations against Bernal No.8 director",2025-04-03,"https://tvwan.com.pg/news/3853"
"Unexploded bomb discovered in attempted arson",2025-04-03,"https://tvwan.com.pg/news/3851"
"Iduhu welcomes decision to recall Parliament",2025-04-03,"https://tvwan.com.pg/news/3850"
"Angoram needs increased budget allocation",2025-04-03,"https://tvwan.com.pg/news/3849"
"Float & Motorcade Set for Day 2 Celebrations",2025-04-03,"https://tvwan.com.pg/news/3848"
"Digicel PNG Invests K20mil to upgrade 4G LTE Network In Lae",2025-04-03,"https://tvwan.com.pg/news/3847"
"Manning revealed 4,000 arrests made in 2024",2025-04-03,"https://tvwan.com.pg/news/3846"
"Police officers continue studies",2025-04-03,"https://tvwan.com.pg/news/3845"
"FAO launches National Forest Inventory Learning Journey",2025-04-02,"https://tvwan.com.pg/news/3839"
"Successful raid by Lae police",2025-04-02,"https://tvwan.com.pg/news/3838"
"Law & Order forum underway",2025-04-02,"https://tvwan.com.pg/news/3837"
"Unitech changes graduation venue",2025-04-02,"https://tvwan.com.pg/news/3836"
"NRI on ways to address lawlessness",2025-04-01,"https://tvwan.com.pg/news/3831"
"Kiunga’s double celebrations",2025-04-01,"https://tvwan.com.pg/news/3829"
"Hela aims to revive 15 rural airstrips",2025-04-01,"https://tvwan.com.pg/news/3827"
"Toare Cultural Centre Open",2025-04-01,"https://tvwan.com.pg/news/3826"
"Fuel Supply Challenges Eased",2025-04-01,"https://tvwan.com.pg/news/3825"
"PNG-NRL Academy Schools Tournament Set for April",2025-04-01,"https://tvwan.com.pg/news/3824"
"Simbu first to submit 2024 performance report",2025-04-01,"https://tvwan.com.pg/news/3823"
"Jimjam health centre embraces EDEN",2025-04-01,"https://tvwan.com.pg/news/3822"
"Hiri Moale Festival Program Begins",2025-04-01,"https://tvwan.com.pg/news/3820"
"CLRC focuses on reviewing police brutality law",2025-04-01,"https://tvwan.com.pg/news/3819"
"80 graduate with nursing diplomas",2025-04-01,"https://tvwan.com.pg/news/3818"
"A Commitment Renewed",2025-03-31,"https://tvwan.com.pg/news/3816"
"Government respects court ruling",2025-03-31,"https://tvwan.com.pg/news/3815"
"Rule of Law march",2025-03-31,"https://tvwan.com.pg/news/3805"
"Taurama incident under investigation",2025-03-30,"https://tvwan.com.pg/news/3804"
"National Criminal Record Office Gordons opened",2025-03-30,"https://tvwan.com.pg/news/3803"
"OTML Chairman Resigns",2025-03-30,"https://tvwan.com.pg/news/3802"
"Nakanai DDA presents 2024 acquittals",2025-03-30,"https://tvwan.com.pg/news/3801"
"Trukai announces home owner winners",2025-03-30,"https://tvwan.com.pg/news/3799"
"Vehicle to Drive Agriculture Forward",2025-03-30,"https://tvwan.com.pg/news/3797"
"Kelua-2 Launches 10-Year Disaster Development Plan",2025-03-29,"https://tvwan.com.pg/news/3794"
"PNG CORE Unveils Climate Change Policy",2025-03-29,"https://tvwan.com.pg/news/3792"
"Strengthening Community Resilience in PNG’s Highlands",2025-03-29,"https://tvwan.com.pg/news/3791"
"IOM hands over IDP policy government",2025-03-29,"https://tvwan.com.pg/news/3790"
"DPM commissions Public Service Housing Project Vehicles",2025-03-29,"https://tvwan.com.pg/news/3789"
"Bougainville transitions to Constituent Assembly",2025-03-29,"https://tvwan.com.pg/news/3788"
"NIP Legislative Assembly Adjourns",2025-03-28,"https://tvwan.com.pg/news/3784"
"38yo male arrested over killings",2025-03-28,"https://tvwan.com.pg/news/3782"
"Tattoos Reviving Cultural Identity",2025-03-28,"https://tvwan.com.pg/news/3781"
"Ginigoada Foundation develops local skills",2025-03-28,"https://tvwan.com.pg/news/3780"
"Bus 7 operators want road fixed",2025-03-28,"https://tvwan.com.pg/news/3776"
"Papua Governors Dialogue Inspires Unity",2025-03-28,"https://tvwan.com.pg/news/3775"
"Committee confident in country’s democracy",2025-03-28,"https://tvwan.com.pg/news/3774"
"Post-Mortem Results Could Spark More Charges Against Kapli",2025-03-28,"https://tvwan.com.pg/news/3772"
"North Coast emerges from the darkness",2025-03-27,"https://tvwan.com.pg/news/3771"
"Court ordered peace ceremony observed",2025-03-27,"https://tvwan.com.pg/news/3770"
"PNG courts welcome three new judges",2025-03-27,"https://tvwan.com.pg/news/3769"
"Motu Koita Assembly Enhances Waste Management",2025-03-27,"https://tvwan.com.pg/news/3765"
"Provinces to be linked",2025-03-27,"https://tvwan.com.pg/news/3763"
"Search on for Miss Gulf",2025-03-27,"https://tvwan.com.pg/news/3762"
"Santos supports Mobile Squad Unit",2025-03-27,"https://tvwan.com.pg/news/3761"
"Vehicle owners and police told to work together to clear traffic yard",2025-03-27,"https://tvwan.com.pg/news/3760"
"Respect privacy of citizens, says Tomuriesa",2025-03-27,"https://tvwan.com.pg/news/3757"
"ICAC initiates first arrest for 2025",2025-03-27,"https://tvwan.com.pg/news/3756"
"Kambu TVET facilities launched",2025-03-26,"https://tvwan.com.pg/news/3753"
"Madang mayor assists self-help project",2025-03-26,"https://tvwan.com.pg/news/3752"
"Normal day despite call to protest",2025-03-26,"https://tvwan.com.pg/news/3749"
"Schools to remain open",2025-03-26,"https://tvwan.com.pg/news/3745"
"New Water tanks for Erap Boys Town",2025-03-25,"https://tvwan.com.pg/news/3744"
"Facebook restriction in response to Terrorist Threats",2025-03-25,"https://tvwan.com.pg/news/3743"
"Former Gazelle MP, Sinai Brown passes on",2025-03-25,"https://tvwan.com.pg/news/3742"
"Cynthia's journey in keeping the family art alive",2025-03-25,"https://tvwan.com.pg/news/3739"
"Media Council calls for transparency",2025-03-25,"https://tvwan.com.pg/news/3738"
"Constable Greg Wii apologises",2025-03-25,"https://tvwan.com.pg/news/3737"
"Waigani Police pilot community policing initiative",2025-03-25,"https://tvwan.com.pg/news/3734"
"Paita back as Mining Minister",2025-03-25,"https://tvwan.com.pg/news/3731"
"Morobe Northern Highway project set for launch",2025-03-25,"https://tvwan.com.pg/news/3728"
"PNG CORE’s Vision",2025-03-24,"https://tvwan.com.pg/news/3726"
"Marape testifies against Yafai",2025-03-24,"https://tvwan.com.pg/news/3721"
"Mailu team joins POM Netball comp",2025-03-24,"https://tvwan.com.pg/news/3719"
"PM shows up to testify",2025-03-24,"https://tvwan.com.pg/news/3718"
"RPNGC members observe Women's Day",2025-03-24,"https://tvwan.com.pg/news/3717"
"Hiritano highway needs immediate fixing",2025-03-23,"https://tvwan.com.pg/news/3713"
"Seven suspects involved in late Margret’s murder",2025-03-23,"https://tvwan.com.pg/news/3712"
"UPNG’s Earth Science Dept boosted",2025-03-23,"https://tvwan.com.pg/news/3711"
"Solider killer apprehended",2025-03-23,"https://tvwan.com.pg/news/3708"
"Bando highlights ambitious plans for the coffee sector",2025-03-22,"https://tvwan.com.pg/news/3703"
"Concerns raised about the delay of Porgera CDA",2025-03-22,"https://tvwan.com.pg/news/3702"
"Solar Innovation Enriching Lives",2025-03-21,"https://tvwan.com.pg/news/3700"
"Law and order awareness for Rabaul students",2025-03-21,"https://tvwan.com.pg/news/3698"
"NCC Advances Policy to Protect Traditional Knowledge",2025-03-21,"https://tvwan.com.pg/news/3694"
"Calls for Better Contractors to Fix Ulapana Road in Rigo District",2025-03-21,"https://tvwan.com.pg/news/3693"
"CPEM recognize lack of teachers",2025-03-21,"https://tvwan.com.pg/news/3689"
"Simbu police acknowledged",2025-03-20,"https://tvwan.com.pg/news/3686"
"Lae police confirm cell breakout",2025-03-20,"https://tvwan.com.pg/news/3681"
"LLG Administration amended Bill passed",2025-03-20,"https://tvwan.com.pg/news/3680"
"DV victim laid to rest",2025-03-20,"https://tvwan.com.pg/news/3678"
"Igitoi confirms K15 million loss to January riots",2025-03-20,"https://tvwan.com.pg/news/3676"
"Maopa cultural celebration",2025-03-20,"https://tvwan.com.pg/news/3675"
"Maopa Celebrates Culture, Tovi Dance",2025-03-20,"https://tvwan.com.pg/news/3674"
"PM reaffirms commitment to building new hospitals",2025-03-20,"https://tvwan.com.pg/news/3673"
"Neville Devete testifies against Yafai",2025-03-20,"https://tvwan.com.pg/news/3672"
"Marape welcomes passage of Fire and Rescue Service Bill 2025",2025-03-20,"https://tvwan.com.pg/news/3671"
"CPL's Water Project Transforms Lives",2025-03-20,"https://tvwan.com.pg/news/3670"
"Wautogik Road to Success",2025-03-20,"https://tvwan.com.pg/news/3669"
"Educate young men",2025-03-19,"https://tvwan.com.pg/news/3665"
"Role of media in development acknowledged",2025-03-19,"https://tvwan.com.pg/news/3664"
"Enforce laws on GBV",2025-03-19,"https://tvwan.com.pg/news/3663"
"10 rescued after 15 hours at sea",2025-03-19,"https://tvwan.com.pg/news/3662"
"New eye clinic at Metoreia",2025-03-19,"https://tvwan.com.pg/news/3659"
"Saii Kay Defends Music, Integrity",2025-03-19,"https://tvwan.com.pg/news/3656"
"Training camp rescheduled for Easter",2025-03-18,"https://tvwan.com.pg/news/3655"
"Regional NRL Bid tournament scheduled",2025-03-18,"https://tvwan.com.pg/news/3653"
"Pindiu driver apprehended",2025-03-18,"https://tvwan.com.pg/news/3652"
"Farmset empowers Madang farmers",2025-03-18,"https://tvwan.com.pg/news/3651"
"Morobe police urged to check drivers",2025-03-18,"https://tvwan.com.pg/news/3650"
"Fashion Dream Takes Flight in PNG",2025-03-18,"https://tvwan.com.pg/news/3647"
"HYTARC TVET students receive laptops",2025-03-18,"https://tvwan.com.pg/news/3646"
"NDOH staff demand appointment permanent secretary",2025-03-18,"https://tvwan.com.pg/news/3643"
"Education Ministers Conference",2025-03-18,"https://tvwan.com.pg/news/3642"
"Tusbab Men Triumph in Rookes Preseason Finals",2025-03-18,"https://tvwan.com.pg/news/3641"
"PNG Gov’t Committed to Bougainville Peace Process",2025-03-17,"https://tvwan.com.pg/news/3635"
"Toroama calls for independence for Bougainville",2025-03-17,"https://tvwan.com.pg/news/3634"
"PM Marape commends Nasfund’s performance",2025-03-17,"https://tvwan.com.pg/news/3632"
"Connect PNG audit underway",2025-03-17,"https://tvwan.com.pg/news/3631"
"Newcastle ends 70-year drought with win over Liverpool in League Cup final",2025-03-17,"https://tvwan.com.pg/news/3630"
"Bugandi notes academic improvement",2025-03-17,"https://tvwan.com.pg/news/3629"
"PNG to host Pacific Education leaders",2025-03-17,"https://tvwan.com.pg/news/3628"
"Police officers urged to pursue further studies",2025-03-16,"https://tvwan.com.pg/news/3622"
"Gerehu Hospital resumes operation tomorrow",2025-03-16,"https://tvwan.com.pg/news/3621"
"National Action Against GBV",2025-03-16,"https://tvwan.com.pg/news/3620"
"PNGRFL visits East Sepik",2025-03-16,"https://tvwan.com.pg/news/3619"
"Police funds queried",2025-03-15,"https://tvwan.com.pg/news/3615"
"Non-functioning of National Lands Board a concern",2025-03-15,"https://tvwan.com.pg/news/3614"
"Hastings Deering helps BbP deliver books to remote locations",2025-03-15,"https://tvwan.com.pg/news/3612"
"Late ToBaining Senior farewelled",2025-03-15,"https://tvwan.com.pg/news/3610"
"ENB police challenged",2025-03-15,"https://tvwan.com.pg/news/3609"
"PM delivers ministerial statement",2025-03-14,"https://tvwan.com.pg/news/3607"
"Aloi takes office",2025-03-14,"https://tvwan.com.pg/news/3606"
"Unemployed face more violence",2025-03-14,"https://tvwan.com.pg/news/3602"
"GBV attitudes worsen",2025-03-14,"https://tvwan.com.pg/news/3600"
"U.S., PNG Strengthen Maritime Security",2025-03-14,"https://tvwan.com.pg/news/3598"
"Street Children Policy launched",2025-03-14,"https://tvwan.com.pg/news/3597"
"PNG, Australia Strengthen Forest Sustainability",2025-03-14,"https://tvwan.com.pg/news/3596"
"Child & Family services gunner support",2025-03-14,"https://tvwan.com.pg/news/3595"
"CEFI bridging the financial gap",2025-03-14,"https://tvwan.com.pg/news/3594"
"Opposition seeks legal redress on Section 145 amendment",2025-03-14,"https://tvwan.com.pg/news/3591"
"Government borrowings not reckless",2025-03-14,"https://tvwan.com.pg/news/3589"
"First Female takes speakers chair",2025-03-14,"https://tvwan.com.pg/news/3588"
"Semoso praised",2025-03-13,"https://tvwan.com.pg/news/3586"
"PPL Faces Multiple Unplanned Power Outages",2025-03-13,"https://tvwan.com.pg/news/3583"
"Polye queries 2024 revenue target",2025-03-13,"https://tvwan.com.pg/news/3582"
"Parliament declares PNG a Christian nation",2025-03-13,"https://tvwan.com.pg/news/3580"
"Moni Plus Strengthens Ties with HMF",2025-03-13,"https://tvwan.com.pg/news/3579"
"Major amendments passed in Parliament",2025-03-13,"https://tvwan.com.pg/news/3577"
"Parliament passes bill to establish new authority",2025-03-13,"https://tvwan.com.pg/news/3576"
"Japanese Language Proficiency Test Returns to PNG for 2025",2025-03-13,"https://tvwan.com.pg/news/3575"
"NEC approves Palm Oil Policy",2025-03-13,"https://tvwan.com.pg/news/3574"
"Paraka’s bail application rejected",2025-03-13,"https://tvwan.com.pg/news/3573"
"MPs encouraged to be like Sir J",2025-03-12,"https://tvwan.com.pg/news/3570"
"Coral bleaching evident in ENB",2025-03-12,"https://tvwan.com.pg/news/3567"
"Voice Inc. honour Sir Michael's legacy",2025-03-12,"https://tvwan.com.pg/news/3566"
